[
  {
    "id": "G3-Q001",
    "domain": "G3",
    "subtopic": "Estructura de la póliza",
    "difficulty": "basica",
    "stem": "¿En qué componente de una póliza de propiedad se encuentran normalmente el asegurado nombrado, la ubicación, los límites, el deducible y el período de vigencia?",
    "options": [
      {
        "id": "A",
        "text": "Declaraciones",
        "rationale": "Correcta. Las Declaraciones personalizan la póliza e identifican los datos concretos del riesgo, incluidos nombres, ubicación, límites, deducibles y fechas."
      },
      {
        "id": "B",
        "text": "Acuerdo de seguro",
        "rationale": "Incorrecta. El Acuerdo de seguro contiene la promesa fundamental de cobertura y los eventos que la activan, no el programa particular del riesgo."
      },
      {
        "id": "C",
        "text": "Condiciones",
        "rationale": "Incorrecta. Las Condiciones establecen deberes, reglas y procedimientos, como el aviso de pérdida, el avalúo y la subrogación."
      },
      {
        "id": "D",
        "text": "Exclusiones",
        "rationale": "Incorrecta. Las Exclusiones identifican riesgos, bienes o clases de pérdidas que quedan fuera de la cobertura."
      }
    ],
    "correctOption": "A",
    "explanation": "Las Declaraciones contienen los datos específicos que adaptan los formularios estándar al riesgo asegurado. El Acuerdo de seguro concede la cobertura básica, las Condiciones regulan su operación y las Exclusiones eliminan determinadas exposiciones.",
    "keyTerms": [
      {
        "es": "Declaraciones",
        "en": "Declarations"
      },
      {
        "es": "Acuerdo de seguro",
        "en": "Insuring Agreement"
      }
    ],
    "source": {
      "file": "G3- Texas P&C Domain G3 Research.es.md",
      "section": "A. Declaraciones"
    },
    "reviewStatus": "pending_expert_review"
  },
  {
    "id": "G3-Q002",
    "domain": "G3",
    "subtopic": "Formación del contrato",
    "difficulty": "intermedia",
    "stem": "Una solicitante pide una póliza con deducible de $1,000. El asegurador ofrece emitirla con deducible de $5,000. ¿Qué representa jurídicamente la respuesta del asegurador?",
    "options": [
      {
        "id": "A",
        "text": "La aceptación incondicional de la oferta original",
        "rationale": "Incorrecta. La aceptación debe corresponder a los términos ofrecidos; aumentar el deducible modifica una condición solicitada."
      },
      {
        "id": "B",
        "text": "Una contraoferta que la solicitante debe aceptar",
        "rationale": "Correcta. Emitir la cobertura en términos diferentes constituye una contraoferta y requiere aceptación para formar el contrato en esos términos."
      },
      {
        "id": "C",
        "text": "Un contrato provisional automático",
        "rationale": "Incorrecta. Un contrato provisional concede cobertura temporal; no surge automáticamente de toda modificación propuesta por el asegurador."
      },
      {
        "id": "D",
        "text": "Una cesión de la póliza",
        "rationale": "Incorrecta. La cesión transfiere derechos contractuales a un cesionario y no describe una modificación de los términos ofrecidos."
      }
    ],
    "correctOption": "B",
    "explanation": "La solicitud normalmente constituye la oferta. Si el asegurador propone términos distintos, formula una contraoferta. La formación del contrato exige oferta y aceptación, contraprestación, partes competentes y objeto lícito.",
    "keyTerms": [
      {
        "es": "Oferta y aceptación",
        "en": "Offer and Acceptance"
      },
      {
        "es": "Contraoferta",
        "en": "Counteroffer"
      },
      {
        "es": "Contrato provisional",
        "en": "Binder"
      }
    ],
    "source": {
      "file": "G3- Texas P&C Domain G3 Research.es.md",
      "section": "N. Elementos de un contrato"
    },
    "reviewStatus": "pending_expert_review"
  },
  {
    "id": "G3-Q003",
    "domain": "G3",
    "subtopic": "Asegurados y endosos",
    "difficulty": "basica",
    "stem": "Una empresa desea extender mediante una modificación escrita cierta protección a un arrendador que no aparece originalmente en las Declaraciones. ¿Qué figura corresponde mejor?",
    "options": [
      {
        "id": "A",
        "text": "Primer asegurado nombrado",
        "rationale": "Incorrecta. El primer asegurado nombrado es la entidad que aparece primero en las Declaraciones y posee determinados derechos administrativos."
      },
      {
        "id": "B",
        "text": "Asegurado automático",
        "rationale": "Incorrecta. Un asegurado automático obtiene esa condición por la definición del formulario, sin necesidad de ser agregado expresamente."
      },
      {
        "id": "C",
        "text": "Asegurado adicional agregado por endoso",
        "rationale": "Correcta. Un tercero puede recibir protección respecto de su interés asegurable al ser incorporado como asegurado adicional mediante un endoso."
      },
      {
        "id": "D",
        "text": "Árbitro dirimente",
        "rationale": "Incorrecta. El árbitro dirimente interviene en un avalúo cuando los tasadores discrepan; no recibe cobertura como tercero."
      }
    ],
    "correctOption": "C",
    "explanation": "El asegurado adicional es un tercero incorporado mediante endoso. Los endosos modifican el contrato base y prevalecen sobre el lenguaje estándar incompatible. Su protección depende del alcance concreto del endoso.",
    "keyTerms": [
      {
        "es": "Asegurado adicional",
        "en": "Additional Insured"
      },
      {
        "es": "Endoso",
        "en": "Endorsement"
      },
      {
        "es": "Primer asegurado nombrado",
        "en": "First Named Insured"
      }
    ],
    "source": {
      "file": "G3- Texas P&C Domain G3 Research.es.md",
      "section": "E. Definición del asegurado"
    },
    "reviewStatus": "pending_expert_review"
  },
  {
    "id": "G3-Q004",
    "domain": "G3",
    "subtopic": "Deberes posteriores a la pérdida",
    "difficulty": "intermedia",
    "stem": "Después de un robo, el asegurado avisa inmediatamente por teléfono. Luego, a solicitud del asegurador, presenta un documento firmado y jurado con el inventario, la valoración y el monto reclamado. ¿Cómo se clasifica este segundo documento?",
    "options": [
      {
        "id": "A",
        "text": "Aviso de reclamación",
        "rationale": "Incorrecta. El aviso es la notificación inicial e informal que alerta al asegurador para comenzar la tramitación."
      },
      {
        "id": "B",
        "text": "Informe investigativo del consumidor",
        "rationale": "Incorrecta. Ese informe reúne datos personales mediante entrevistas para fines de suscripción y está regulado por la FCRA."
      },
      {
        "id": "C",
        "text": "Endoso de cobertura",
        "rationale": "Incorrecta. Un endoso modifica los términos de la póliza y no documenta los detalles de una pérdida ya ocurrida."
      },
      {
        "id": "D",
        "text": "Comprobante de pérdida",
        "rationale": "Correcta. Es la declaración formal, firmada y jurada que detalla la pérdida, los bienes afectados, su valoración y la suma reclamada."
      }
    ],
    "correctOption": "D",
    "explanation": "El aviso de reclamación inicia informalmente el proceso. El comprobante de pérdida es formal y jurado; normalmente debe presentarse dentro de los 60 días posteriores a la solicitud del asegurador y activa el plazo aplicable para decidir la reclamación.",
    "keyTerms": [
      {
        "es": "Aviso de reclamación",
        "en": "Notice of Claim"
      },
      {
        "es": "Comprobante de pérdida",
        "en": "Proof of Loss"
      }
    ],
    "source": {
      "file": "G3- Texas P&C Domain G3 Research.es.md",
      "section": "I. Comprobante de pérdida"
    },
    "reviewStatus": "pending_expert_review"
  },
  {
    "id": "G3-Q005",
    "domain": "G3",
    "subtopic": "Plazos de reclamaciones en Texas",
    "difficulty": "avanzada",
    "stem": "Un asegurador de Texas recibe todos los elementos solicitados y el comprobante final de una reclamación ordinaria por granizo. No existe sospecha de incendio provocado. ¿Cuál es el plazo general para comunicar por escrito la aceptación o el rechazo?",
    "options": [
      {
        "id": "A",
        "text": "15 días hábiles",
        "rationale": "Correcta. La decisión debe notificarse generalmente dentro de los 15 días hábiles posteriores a recibir todos los elementos solicitados y el comprobante final."
      },
      {
        "id": "B",
        "text": "15 días calendario",
        "rationale": "Incorrecta. Los 15 días calendario corresponden al acuse de recibo, inicio de la investigación y solicitud de información después del aviso."
      },
      {
        "id": "C",
        "text": "5 días hábiles",
        "rationale": "Incorrecta. Ese es el plazo general para pagar después de notificar que la reclamación fue aceptada."
      },
      {
        "id": "D",
        "text": "30 días calendario",
        "rationale": "Incorrecta. El plazo de 30 días calendario se relaciona con una sospecha razonable de incendio provocado, ausente en el supuesto."
      }
    ],
    "correctOption": "A",
    "explanation": "La secuencia general de Texas distingue 15 días calendario para acusar recibo e iniciar la investigación, 15 días hábiles para decidir tras recibir la documentación completa y 5 días hábiles para pagar después de aceptar.",
    "keyTerms": [
      {
        "es": "Ley de Pago Oportuno de Reclamaciones de Texas",
        "en": "Texas Prompt Payment of Claims Act"
      },
      {
        "es": "Aceptación o rechazo",
        "en": "Acceptance or Rejection"
      }
    ],
    "source": {
      "file": "G3- Texas P&C Domain G3 Research.es.md",
      "section": "G. Obligaciones de la compañía de seguros"
    },
    "reviewStatus": "pending_expert_review"
  },
  {
    "id": "G3-Q006",
    "domain": "G3",